,bn:00750078n,"hindu_music, hindu_songs",Hindu music is music created for or influenced by Hinduism.,,YES
,bn:00750438n,"narodna_muzika, folk_muzika","Narodna muzika also called Folk muzika means folk music in the South Slavic languages; Bosnian, Bulgarian, Macedonian, Montenegrin and Serbian.",,YES
,bn:00753886n,yuman_music,"Yuman music is the music of Yumans, a group of Native American tribes from what is now Southern California and Baja California.",,YES
,bn:00781959n,"cântec_batrânesc, cantec_batranesc",Cântec batrânesc is a traditional form of ballad which originates from Romania.,,YES
,bn:00791135n,"sioux_music, dakota_music, nakota_music, lakota_music","The Sioux are a large group of Native Americans generally divided into three subgroups: Lakota, Dakota and Nakota.",,YES
,bn:00791149n,iroquois_music,The Iroquois is a confederacy of six Native American tribes.,,YES
,bn:00809924n,afrocubanismo,"Afrocubanismo was an artistic and social movement in black-themed Cuban culture with origins in the 1920s, as in works by the cultural anthropologist Fernando Ortiz.",,NO
,bn:00817931n,"dappan_koothu, tappaankuthu, dappankuthu, dappanguthu, tappankuthu, dappaankuthu, tapanguchi, dappaan_koothu",Dappan Koothu is a folk dance and music genre with an emphasis on percussion performed in the South Indian state of Tamil Nadu.,,YES
,bn:00825954n,"psychoanalysis_and_music, music&psychoanalysis","Music has the ability to open doors, which allow us to see beyond a typical conversation or thought process.",,YES
,bn:00834789n,uruguayan_rock,Uruguayan rock first emerged in Uruguay in the 1950s.,,YES
,bn:00880577n,"chicano_rock, pachucho_punk, chicano_punk, chicago_rock, latin-rock-goddess",Chicano rock is rock music performed by Mexican American groups or music with themes derived from Chicano culture.,,YES
,bn:00892042n,"canadian_classical_music, canadian_composition, canadian_compositions","In Canada, classical music includes a range of musical styles rooted in the traditions of Western or European classical music that European settlers brought to the country from the 17th century and onwards.",,YES
,bn:00896539n,"pakistani_hip_hop, pakistani_hip_hop_music, urdu_hip_hop, urdu_rap, punjabi_rap, pakistani_underground_music, punjabi_hip_hop, pakistani_rap, sindhi_hip_hop",Pakistani hip hop is a music genre in Pakistan influenced heavily from merging American hip hop style beats with Pakistani poetry.,,YES
,bn:00908751n,"bristol_underground_scene, bristol_sound, bristol_urban_culture","The Bristol underground scene, refers to a cultural movement in Bristol beginning in the early 1980s.",,YES
,bn:00911030n,layali,"Layālī is a style of unmetered modal improvisation, based on a maqam, performed by a singing voice in Arabic music.",,YES
,bn:00913220n,junglist,"Junglist is a slang term which first referred to a person living in an area of West Kingston, Jamaica, called Jungle.",,NO
,bn:00917890n,dawr,A dawr is a genre of Arabic vocal music sung in regional or colloquial Arabic.,,YES
,bn:00939740n,"industrial_hip_hop, noise_rap, industrial_hip-hop, industrial_rap, indust_hip_hop, indust_rap",Industrial hip hop is a fusion genre of industrial music and hip hop.,,YES
,bn:00962191n,"rock_music_in_lithuania, lithuanian_rock",Rock music has been performed and heard in Lithuania since the mid-1960s.,,YES
,bn:00962539n,mbira_music,"In Zimbabwean music, mbira music is music played on an mbira, a traditional instrument of the Shona people of Zimbabwe.",,YES
,bn:00962663n,"new_orleans_rhythm_and_blues, new_orleans_rhythm_&_blues, new_orleans_sound, the_new_orleans_sound, new_orleans_r&b, new_orleans_rhythm_'n'_blues",New Orleans rhythm and blues is a style of rhythm and blues music that originated in the U.S. city of New Orleans.,,YES
,bn:00994365n,"reggae_rock, reggae_metal, reggae-rock, cali_reggae, rock_reggae, ragga_metal","Reggae rock is a subgenre of reggae fusion and rock music that primarily uses the genres reggae, rock and ska.",,YES
,bn:01006000n,,呢個音樂作品一覽記錄歌手張學友歷年出嘅嘅音樂作品。,,NO
,bn:01011896n,,Biofoonia on eluhäälte kogum ökosüsteemi helimaastikus.,,YES
,bn:01013542n,australian_thrash_metal,Australian thrash metal is a regional scene of thrash metal music that originated during the late 1980s.,,YES
,bn:01033785n,"pakistani_music_journalism, pakistan_music_journalism",Music journalism in Pakistan has grown especially with the growth of the country's pop music industry and scene.,,YES
,bn:01034360n,"filmi_pop, filmi-pop","Filmi pop is a term first coined by Pakistani music journalist, Ali Tim in 1990 but made famous by the country's most influential pop critic, Nadeem F. Paracha.",,YES
,bn:01045230n,"australian_hardcore, list_of_australian_hardcore_punk_groups, list_of_australian_hardcore_punk_and_metalcore_groups, australian_hardcore_punk","Australian hardcore punk bands tend to have local fan bases, although a number have toured Australia and internationally.",,YES
,bn:01048546n,french_classical_music,"French classical music began with the sacred music of the Roman Catholic Church, with written records predating the reign of Charlemagne.",,YES
,bn:01052975n,lu,"Lu is a Tibetan style of folk music of a cappella songs, which are distinctively high in pitch with glottal vibrations.",,YES
,bn:01063270n,dene_music,"The Dene and their direct language relations live in the Yukon, Northwest Territories, British Columbia, Alberta, Saskatchewan, Manitoba, as well as some parts of California, and through to the Apache and Navajo lands in the South Central United States.",,YES
,bn:01072408n,post-industrial_music,Music genre,,YES
,bn:01076598n,pyeongtaek_nongak,Pyeongtaek nongak is a nongak or Korean farmer's music which has been performed and handed down in the Pyeongtaek region of Gyeonggi Province.,,YES
,bn:01078513n,"pinoy_reggae, filipino_reggae",Filipino reggae or Pinoy reggae is reggae music created in the Philippines.,,YES
,bn:01082099n,"stev, kveder, gamle-stev",Stev is a form of Norwegian folk song consisting of four line lyric stanzas.,,YES
,bn:01115270n,polish_reggae,Reggae is one of the most popular music genres in Poland.,,YES
,bn:01130189n,pipe_banner,A pipe banner is a decorative flag for the Scottish Highland bagpipes.,,NO
,bn:01132858n,"zortziko, zortzico, zorzico",The zortziko is a dance rhythm that originates in the Basque Country.,,YES
,bn:01145168n,algerian_hip_hop,"Algerian hip hop music, as a genre, includes the hip hop music of both native Algerians and Algerians abroad.",,YES
,bn:01147212n,"ivorian_hip_hop, ivoirian_hip_hop","Hip hop is a major part of the popular music of Côte d'Ivoire, and has been fused with many of the country's native styles, such as zouglou.",,YES
,bn:01163672n,sarajevo_school_of_pop_rock,"The Sarajevo school of pop rock collectively refers to the popular music created between 1960 and 1991 by artists and bands native to Sarajevo, Bosnia and Herzegovina.",,YES
,bn:01179196n,"jewish_art_music_movement, jewish_art_music, society_for_jewish_music, society_for_jewish_folk_music","The Jewish art music movement began at the end of the 19th century in Russia, with a group of Russian Jewish classical composers dedicated to preserving Jewish folk music and creating a new, characteristically Jewish genre of classical music.",,YES
,bn:01180383n,"australian_country_music, new_zealander_country_music, australian_country-rock, list_of_australian_country_musicians",Australian country music is a part of the music of Australia.,,YES
,bn:01186496n,"popular_music_in_sweden, swedish_music_export, swedish_music_abroad, swedish_pop_music, swedish_rock, swedish_pop, swedish_rock_music","Swedish popular music, also called Swedish pop music, or just Swedish pop, refers to music that has swept the Swedish mainstream at any given point in recent times.",,YES
,bn:01195200n,xhosa_music,"Xhosa music has long been a major part of the music of South Africa, especially in the field of jazz.",,YES
,bn:01209096n,zulu_music,The Zulu people are a South African ethnic group.,,YES
,bn:01209128n,innu_music,The Innu are among the First Nations of Canada.,,YES
,bn:01232800n,music_in_ancient_india,"Music in ancient India, encompassing the Indian subcontinent, can be reproduced from written works dating to the Indian classical period, such as the Nātya Shastra, and through surviving examples of liturgical music such as the hymns of the Samaveda.",,YES
,bn:01252852n,"oberheim_matrix_synthesizers, matrix-12, oberheim_matrix, matrix-1000, matrix-6, matrix_1000, matrix_6, matrix_12","Oberheim Matrix synthesizers are a historic product line of subtractive analog synthesizers from Oberheim featuring a system of modulation which Oberheim called ""Matrix Modulation"" as a method of selecting and routing elements that dynamically shape various aspects of the sounds it produces.",,YES
,bn:01262732n,spanish_opera,Spanish opera is both the art of opera in Spain and opera in the Spanish language.,,YES
,bn:01274130n,"accordion_music_genres, accordion_music, classical_accordion","The accordion is in a wide variety of musical genres, mainly in traditional and popular music.",,YES
,bn:01285198n,kanto,Kanto is a popular genre of Turkish music.,,YES
,bn:01310905n,brindisi,"A brindisi is a song in which a company is exhorted to drink, a drinking song.",,YES
,bn:01313483n,"caribbean_music_in_the_united_kingdom, british_reggae, carribean_music_in_the_united_kingdom, white_reggae, black_british_music, british_school_of_reggae, jamaican_music_in_the_united_kingdom, jamaican_music_in_the_united_kingom",People of African descent from the Caribbean have made significant contributions to British Black music for many generations.,,YES
,bn:01321130n,pagan_rock,Pagan rock is a genre of rock music created by adherents of neopagan traditions.,,YES
,bn:01336960n,"nisiotika, music_of_the_aegean_islands, music_of_the_cyclades, music_of_the_dodecanese_islands","Nisiotika are the songs and dances of Greek islands with a variety of styles, played by ethnic Greeks in Greece, Cyprus, Australia, the United States and elsewhere.",,YES
,bn:01356067n,"celtic_music_in_the_united_states, scottish-american_music, irish-american_music, irish_american_music, scottish_american_music","Irish, Scottish and Welsh music have long been a major part of American music, at least as far back as the 18th century.",,YES
,bn:01361343n,"experimental_hip_hop, experimental_hip-hop, experimental_rap, psychedelic_hip-hop, abstract_hiphop, avant-garde_rap, avanthop, experimental_rap/hip-hop, leftfield_hip_hop, psychedelic_hip_hop, abstract_hip_hop, art_rap, avant-garde_hip_hop, indie_rap, abstract_rap, abstract_hip-hop, left-field_hip_hop, psychedelic_rap",Experimental hip hop is a sub-genre of hip hop that employs structural elements typically considered unconventional in traditional hip hop music.,,YES
,bn:01384463n,creole_music_melodies,Optional.empty,,YES
,bn:01389996n,tokari_geet,Tokari geet is a type of Assamese folk song sung playing a Tokari.,,YES
,bn:01393148n,jazz_education,Each style and era of jazz adopted new techniques to help educate younger musicians.,,YES
,bn:01393753n,"phleng_phuea_chiwit, songs_for_life, pleng_phua_cheewit, song_for_life, phleng_pheua_chiwit",Phleng phuea chiwit,,YES
,bn:01397214n,"nu_gaze, nu-gaze, post-shoegaze, new_wave_of_shoegaze, newgaze, nugazing, post_shoegaze, new_gaze, new_wave_of_shoegazing, nugaze, nu_gazing, shoetronica",Nu gaze refers to a form of alternative rock that originated in the 2000s that is directly influenced by the primarily British shoegaze scene of the late 1980s and early 1990s.,,YES
,bn:01401510n,"music_at_sporting_events, music_in_football","The use of music at sporting events is a practice that is thousands of years old, but has recently had a resurgence as a noted phenomenon.",,YES
,bn:01422372n,"punto_guajiro, punto_cubano","Punto guajiro or punto cubano – or simply punto – is a sung genre of Cuban music, a poetic art with music.",,YES
,bn:01437073n,"minneapolis_hardcore, list_of_minneapolis_hardcore_bands",Minneapolis hardcore is a form of hardcore punk that has evolved since the mid-1970s.,,YES
,bn:01451326n,"music_and_artificial_intelligence, artificial_intelligence_and_music","Research in artificial intelligence is known to have impacted medical diagnosis, stock trading, robot control, and several other fields.",,YES
,bn:01459160n,"qupai, 曲牌, qu_pai",A qupai is the generic term for a fixed melody used in traditional Chinese music.,,YES
,bn:01467060n,"folk_baroque, chamber_folk, baroque_guitar","Folk baroque or baroque guitar, and also sometimes called chamber folk, is a distinctive and influential guitar fingerstyle developed in Britain in the 1960s, which combined elements of American folk, blues, jazz and ragtime with British traditional music to produce a new and elaborate form of accompaniment.",,YES
,bn:01492115n,"early_music_of_the_british_isles, british_renaissance_music, english_medieval_music, tudor_music, english_early_music, traditional_music_of_the_united_kingdom, early_music_of_britain, british_early_music, british_medieval_music, english_renaissance_music","Early music of the British Isles, from the earliest recorded times until the beginnings of the Baroque in the 17th century, was a diverse and rich culture, including sacred and secular music and ranging from the popular to the elite.",,YES
,bn:01523723n,bobre,"The bobre is a musical bow traditional in Mauritius and Réunion, particularly the traditional genres, sega and maloya.",,YES
,bn:01531420n,"kuaiban, kuai_ban",Kuaiban is a form of oral storytelling performance that is popular in northern China.,,YES
,bn:01533149n,"township_music, township_jazz","Township music is any of various music genres created by Bantu peoples living in poor, racially segregated urban areas of South Africa during the 20th century.",,YES
,bn:01540826n,earthmover,Optional.empty,,NO
,bn:01548039n,"hindi_dance_music, hindi_dance_songs, item_boy, hindi_style_dance_songs, bollywood_cabaret_song, bollywood_dance",Hindi dance music encompasses a wide range of songs predominantly featured in the Bollywood film industry with a growing worldwide attraction.,,YES
,bn:01549708n,tamil_folk_culture,Tamil folk culture refers to folk arts and crafts of the Tamil people.,,NO
,bn:01560841n,tololoche,The tololoche is a traditional musical instrument from southern Mexico.,,YES
,bn:01562450n,"australian_folk_music, australian_folk_songs",Australian folk music is the traditional music from the large variety of immigrant cultures and those of the original Australian inhabitants.,,YES
,bn:01590640n,"areíto, areyto, areíto_/_areyto, areito",The areíto or areyto was a Taíno language word adopted by the Spanish colonizers to describe a type of religious song and dance performed by the Taíno people of the Caribbean.,,YES
,bn:01606538n,"japanese_hardcore, japanese_hardcore_punk, japcore","Japanese hardcore is the hardcore punk scene in Japan, which originated to protest the social and economic changes sweeping the country in the 1980s.",,YES
,bn:01616133n,"canadian_punk_rock, toronto_punk_rock","The first punk rock bands in Canada emerged during the late 1970s, in the wake of the US bands Ramones, The New York Dolls, and Blondie, and the UK band Sex Pistols.",,YES
,bn:01621718n,ca_din_tulnic,Ca din tulnic is a unique type of doina in which the melody resembles a type of Alpenhorn called the tulnic.,,YES
,bn:01626342n,"pinoy_pop, opm_pop, p-pop, k-pop, filipino_pop","Pinoy pop, also known as Philippine pop, Filipino pop or P-pop, refers to a popular contemporary music in the Philippines originating from the OPM genre.",,YES
,bn:01632721n,gato,The gato is a style of Argentine music and the associated dance.,,YES
,bn:01640398n,bocet,Bocet is a form of Romanian folk music.,,YES
,bn:01640491n,latin_metal,"Latin metal is a subgenre of heavy metal music with Latin origins, influences, and instrumentation, such as Spanish vocals, Latin percussion and rhythm such as Salsa rhythm.",,YES
,bn:01643007n,ancient_celtic_music,"Deductions about the music of the ancient Celts of the La Tène period rely primarily on Greek and Roman sources, as well as on archaeological finds and interpretations including the reconstruction of the Celts' ancient instruments.",,YES
,bn:01659978n,"british_soul, british_contemporary_r&b, british_soul_music, brit_soul, british_soul_invasion","British soul, Brit soul, or the British soul invasion, is soul music performed by British artists.",,YES
,bn:01704162n,jewish_prayer_modes,Jewish liturgical music is characterized by a set of musical modes.,,YES
,bn:01712953n,ver,"Ver or Voviyo are songs sung during the pre-marriage ceremony known as Ros in Goa, India.",,YES
,bn:01712963n,ovi,"Ovi are wedding songs in Goa, India, sung during the pre-marriage ceremony known as Chuddo and Sado ceremony during which the red dress sado is stitched by a tailor.",,YES
,bn:01712988n,fell,"Fell is a music genre performed by Goan Catholic men and women during the Goa Carnival before the Lent in Goa, India.",,YES
,bn:01720385n,canadian_music_genres,Canadian music genres identifies musical sounds as belonging to a particular category and type of music that can be distinguished from other types of music made by Canadians.,,YES
,bn:01720400n,music_of_canadian_cultures,Music of Canadian Cultures is a wide and diverse accumulation of music from many different individual communities all across Canada.,,YES
,bn:01740157n,"historical_classical_music_recordings, historical_classical_music_recording","Historical classical music recordings are generally classical music recordings made prior to the stereo era of vinyl disc recording, which began around 1957.",,YES
,bn:01756037n,"history_of_music_in_the_biblical_period, music_of_the_canaanites, biblical_music, history_of_music_of_the_bible, music_as_a_divine_art, music_in_the_bible, music_of_the_bible, bible_music",Knowledge of the biblical period is mostly from literary references in the Bible and post-biblical sources.,,YES
,bn:01762444n,"titular_line, title_drop, title_line","The titular line is a line in a film, book or song which includes the name of the film, book or song.",,YES
,bn:01773303n,"rock_music_in_albania, albanian_rock","Albanian rock describes music in Albania, Kosovo, North Macedonia and other Albanian-inhabited areas closely related to western rock.",,YES
,bn:01796625n,"gypsy_style, gipsy_style, finnish_gypsy_songs","The term gypsy style refers to the typical way East European music is played in coffeehouses and restaurants, at parties, and sometimes on-stage, in European cities.",,YES
,bn:01807271n,"drop, bass_drop, beat_drop","A drop or beat drop in music, made popular by electronic dance music styles, is a point in a music track where a sudden change of rhythm or bass line occurs, which is preceded by a build-up section and break.",,YES
,bn:01808165n,"music_of_kenya, kenyan_music, kenyan_musicians, kenyan_traditional_music, hotel_pop, mashindano_ni_matezo","The music of Kenya is very diverse, with multiple types of folk music based on the variety over 40 regional languages.",,YES
,bn:01813357n,"21st-century_classical_music, 21st_century_classical_music","21st-century classical music is art music, in the contemporary classical tradition, that has been produced since the year 2000.",,YES
,bn:01815701n,"alternative_reggaeton, alt_reggaeton, alternative-reggaeton","Alternative reggaeton is a subgenre of reggaeton that emerged from the hip hop movement as a reaction to its repetitive and monotone dembow rhythm, and the predominant stereotypical gangsta content that became predictable.",,YES
,bn:01816486n,music_of_dominica,The music of Dominica includes a variety of genres including all the popular genres of the world.,,YES
,bn:01855122n,piano_repertoire,"The piano repertoire is the set of all pieces of music written for one or more pianists, performed on one or more pianos, with or without other instruments.",,YES
,bn:01856727n,"bushi, bushi_musical_term",Bushi is a type of Japanese folk music genre.,,YES
,bn:01868702n,"music-specific_disorders, music_disorder, music_specific_disorders, musical_disorder",Neuroscientists have learned a lot about the role of the brain in numerous cognitive mechanisms by understanding corresponding disorders.,,YES
,bn:01871086n,dominican_salsa,"While the Dominican Republic is known for shaping merengue and bachata music, its musicians have also melded these influences into the early development of salsa music amongst the Latin community of New York City in the early 1960s.",,YES
,bn:01874428n,hong_kong_hip_hop,Hip hop can be traced in Hong Kong from the early 1990s with singers such as Sandy Lam and Shirley Kwan.,,YES
,bn:01874932n,"suyá_music, suya_music","Suyá music is the music of the Suyá people, a tribe of about 150 people who live on the Suyá-Miçu River and are native to Mato Grosso, Brazil.",,YES
,bn:01880961n,osogovka,"Osogovka is a Macedonian folk dance and its music, rhythm, costumes and geographical originate from the villages of Osogovo Mountain.",,YES
,bn:01890007n,"indie_rock_in_the_netherlands, rock_music_in_the_netherlands, dutch_rock, indie_rock_in_holland, dutch_pop_music","Dutch rock is a form of rock music produced in the Netherlands, primarily in the English language as well as in Dutch.",,YES
,bn:01903044n,ballon,Ballon is the appearance of being lightweight and light-footed while jumping.,,NO
,bn:01904618n,"ethnoambient, ethno_ambient","Ethnoambient is a type of music from the 1980s that draws heavily from acoustic ethnic music - both in musical structure and instrumentation, electric world music, and combines those influences with ambient music related to texture, technological manipulations, and field recordings.",,YES
,bn:01911217n,"t'ong_guitar, t'ong, tong_guitar, tonggita",T'ong guitar was a form of Korean music developed in the early 1970s.,,YES
,bn:01920064n,"argentine_cumbia, cumbia_of_argentina, pop_cumbia",Argentine cumbia is an umbrella term that comprises several distinct trends within the same tradition: the dance and music style known as cumbia in Argentina.,,YES
,bn:01923623n,"misogyny_in_hip_hop_culture, misogyny_in_rap_music","Misogyny in rap music refers to lyrics, videos or other aspects of rap music that support, glorify, justify, or normalize the objectification, exploitation, or victimization of women.",,YES
,bn:01932996n,anglo-american_music,Anglo-American music is derived from the English culture of the Thirteen Colonies of the United States and has been a founding influence for American folk and popular music.,,YES
,bn:01941834n,czech_bluegrass,Czech Bluegrass is Czech interpretations of bluegrass music that emerged during the middle of the twentieth century in the southeastern United States.,,YES
,bn:01945147n,"tizita, tezeta, ትዝታ",Tizita is a music genre in Ethiopia and Eritrea consisting of ballad form.,,YES
,bn:01948156n,azerbaijani_jazz,"The Azerbaijani jazz is a popular variety of jazz, widespread in Azerbaijan.",,YES
,bn:01951529n,"canadian_jazz, jazz_in_canada",Canadian jazz refers to the jazz and jazz-related music performed by jazz bands and performers in Canada.,,YES
,bn:01952273n,"new_wave_music_in_yugoslavia, novi_talas, novi_val, new_wave_in_yugoslavia, nov_bran, the_yugoslav_new_wave_music_scene, new_wave_scene_in_yugoslavia, the_new_wave_scene_in_yugoslavia, the_yugoslav_new_wave_scene, yugoslav_new_wave, yugoslav_new_wave_music_scene, yu_new_wave, yugoslav_new_wave_music",New wave in Yugoslavia was the new wave music scene of the Socialist Federal Republic of Yugoslavia.,,YES
,bn:01955558n,sakara_music,Sakara music is a form of popular Nigerian music based in the traditions of Yoruba music.,,YES
,bn:01967649n,yuka,"Yuka is a secular Afro-Cuban musical tradition which involves drumming, singing and dancing.",,YES
,bn:01974309n,"papare, srilankan_papare",Papare is a form of music which originated in Sri Lanka.,,YES
,bn:01974344n,"hungarian_rock, rock_music_in_hungary, hungarian_alternative",Hungarian rock has been a part of the popular music of Hungary since the early 1960s.,,YES
,bn:01983583n,"new_brunswick,_new_jersey_music_scene","New Brunswick, New Jersey's music scene has been the home to many notable rock bands.",,YES
,bn:01987507n,"traditional_gaelic_music, gaelic_traditional_music","Traditional Gaelic music is the folk music of Goidelic-speaking communities in Ireland, Scotland, and the Isle of Man, often including lyrics in those languages.",,YES
,bn:01991601n,oltremontani,Oltremontani were those of the Franco-Flemish School of composers who dominated the musical landscape of Northern Italy during the middle of the sixteenth Century.,,YES
,bn:02023997n,"american_music_during_world_war_ii, american_music_during_world_war_two, yankee_doodle_ain't_doodlin'_now",American music during World War II was considered to be popular music that was enjoyed during the late 1930s through the mid-1940s.,,YES
,bn:02036151n,,世界盃主題曲是世界盃足球賽的主題曲，下表即羅列歷屆世界盃足球賽主題曲。,,YES
,bn:02038694n,nigerian_reggae,Reggae is a style of Jamaican music that evolved in the late 1960s.,,YES
,bn:02038702n,nigerian_gospel,Gospel songs are a kind of motivational Christian music that has become a major part of Nigerian music.,,YES
,bn:02052256n,"early_music_festivals, list_of_early_music_festivals, early_music_festival","Early music festivals is a generic term for musical festivals focused on music before Beethoven, or including historically informed performance of later works.",,YES
,bn:02076327n,music_and_political_warfare,Music and political warfare have been used together in many different political contexts and cultures as a way to reach a targeted audience in order to deliver a specific political message.,,YES
